{
    "uuid": "b9e6afab-83f8-52a4-9986-d4fb091a4c27",
    "title": "Nichelle and Nancy: The Influence of Demographic Attributes and Tokenization Length on First Name Biases",
    "conference_full": "Annual Meeting of the Association for Computational Linguistics",
    "conference": "ACL",
    "year": 2023,
    "volume": "Proceedings of the 61st Annual Meeting of the Association for Computational Linguistics (Volume 2: Short Papers)",
    "bibtex": "@inproceedings{an-rudinger-2023-nichelle,\n    title = \"Nichelle and Nancy: The Influence of Demographic Attributes and Tokenization Length on First Name Biases\",\n    author = \"An, Haozhe  and\n      Rudinger, Rachel\",\n    editor = \"Rogers, Anna  and\n      Boyd-Graber, Jordan  and\n      Okazaki, Naoaki\",\n    booktitle = \"Proceedings of the 61st Annual Meeting of the Association for Computational Linguistics (Volume 2: Short Papers)\",\n    month = jul,\n    year = \"2023\",\n    address = \"Toronto, Canada\",\n    publisher = \"Association for Computational Linguistics\",\n    url = \"https://aclanthology.org/2023.acl-short.34\",\n    doi = \"10.18653/v1/2023.acl-short.34\",\n    pages = \"388--401\",\n    abstract = \"Through the use of first name substitution experiments, prior research has demonstrated the tendency of social commonsense reasoning models to systematically exhibit social biases along the dimensions of race, ethnicity, and gender (An et al., 2023). Demographic attributes of first names, however, are strongly correlated with corpus frequency and tokenization length, which may influence model behavior independent of or in addition to demographic factors. In this paper, we conduct a new series of first name substitution experiments that measures the influence of these factors while controlling for the others. We find that demographic attributes of a name (race, ethnicity, and gender) and name tokenization length are both factors that systematically affect the behavior of social commonsense reasoning models.\",\n}\n",
    "authors": [
        "Haozhe An",
        "Rachel Rudinger"
    ],
    "pdf_url": "https://aclanthology.org/2023.acl-short.34.pdf",
    "pdf_path": "data/dataset/airqa/papers/acl2023/b9e6afab-83f8-52a4-9986-d4fb091a4c27.pdf",
    "abstract": "Through the use of first name substitution experiments, prior research has demonstrated the tendency of social commonsense reasoning models to systematically exhibit social biases along the dimensions of race, ethnicity, and gender (An et al., 2023). Demographic attributes of first names, however, are strongly correlated with corpus frequency and tokenization length, which may influence model behavior independent of or in addition to demographic factors. In this paper, we conduct a new series of first name substitution experiments that measures the influence of these factors while controlling for the others. We find that demographic attributes of a name (race, ethnicity, and gender) and name tokenization length are both factors that systematically affect the behavior of social commonsense reasoning models.",
    "num_pages": 14
}