{
    "uuid": "cc28a219-3ac4-5614-ba45-59d6aabf1af4",
    "title": "On the Evaluation of Neural Selective Prediction Methods for Natural Language Processing",
    "conference_full": "Annual Meeting of the Association for Computational Linguistics",
    "conference": "ACL",
    "year": 2023,
    "volume": "Proceedings of the 61st Annual Meeting of the Association for Computational Linguistics (Volume 1: Long Papers)",
    "bibtex": "@inproceedings{gu-hopkins-2023-evaluation,\n    title = \"On the Evaluation of Neural Selective Prediction Methods for Natural Language Processing\",\n    author = \"Gu, Zhengyao  and\n      Hopkins, Mark\",\n    editor = \"Rogers, Anna  and\n      Boyd-Graber, Jordan  and\n      Okazaki, Naoaki\",\n    booktitle = \"Proceedings of the 61st Annual Meeting of the Association for Computational Linguistics (Volume 1: Long Papers)\",\n    month = jul,\n    year = \"2023\",\n    address = \"Toronto, Canada\",\n    publisher = \"Association for Computational Linguistics\",\n    url = \"https://aclanthology.org/2023.acl-long.437\",\n    doi = \"10.18653/v1/2023.acl-long.437\",\n    pages = \"7888--7899\",\n    abstract = \"We provide a survey and empirical comparison of the state-of-the-art in neural selective classification for NLP tasks. We also provide a methodological blueprint, including a novel metric called refinement that provides a calibrated evaluation of confidence functions for selective prediction. Finally, we supply documented, open-source code to support the future development of selective prediction techniques.\",\n}\n",
    "authors": [
        "Zhengyao Gu",
        "Mark Hopkins"
    ],
    "pdf_url": "https://aclanthology.org/2023.acl-long.437.pdf",
    "pdf_path": "data/dataset/airqa/papers/acl2023/cc28a219-3ac4-5614-ba45-59d6aabf1af4.pdf",
    "abstract": "We provide a survey and empirical comparison of the state-of-the-art in neural selective classification for NLP tasks. We also provide a methodological blueprint, including a novel metric called refinement that provides a calibrated evaluation of confidence functions for selective prediction. Finally, we supply documented, open-source code to support the future development of selective prediction techniques.",
    "num_pages": 12,
    "tldr": "Survey and compare neural selective prediction methods for NLP with new metrics.",
    "tags": [
        "neural selective classification",
        "natural language processing",
        "confidence functions",
        "empirical comparison",
        "open-source code"
    ]
}