{
    "uuid": "6b887e82-ca3f-59e1-ae8a-f528919c1334",
    "title": "Llama 2: Open Foundation and Fine-Tuned Chat Models",
    "conference": "arxiv",
    "conference_full": "ArXiv",
    "volume": null,
    "year": 2023,
    "authors": [
        "Hugo Touvron",
        "Louis Martin",
        "Kevin Stone",
        "Peter Albert",
        "Amjad Almahairi",
        "Yasmine Babaei",
        "Nikolay Bashlykov",
        "Soumya Batra",
        "Prajjwal Bhargava",
        "Shruti Bhosale",
        "Dan Bikel",
        "Lukas Blecher",
        "Cristian Canton Ferrer",
        "Moya Chen",
        "Guillem Cucurull",
        "David Esiobu",
        "Jude Fernandes",
        "Jeremy Fu",
        "Wenyin Fu",
        "Brian Fuller",
        "Cynthia Gao",
        "Vedanuj Goswami",
        "Naman Goyal",
        "Anthony Hartshorn",
        "Saghar Hosseini",
        "Rui Hou",
        "Hakan Inan",
        "Marcin Kardas",
        "Viktor Kerkez",
        "Madian Khabsa",
        "Isabel Kloumann",
        "Artem Korenev",
        "Punit Singh Koura",
        "Marie-Anne Lachaux",
        "Thibaut Lavril",
        "Jenya Lee",
        "Diana Liskovich",
        "Yinghai Lu",
        "Yuning Mao",
        "Xavier Martinet",
        "Todor Mihaylov",
        "Pushkar Mishra",
        "Igor Molybog",
        "Yixin Nie",
        "Andrew Poulton",
        "Jeremy Reizenstein",
        "Rashi Rungta",
        "Kalyan Saladi",
        "Alan Schelten",
        "Ruan Silva",
        "Eric Michael Smith",
        "Ranjan Subramanian",
        "Xiaoqing Ellen Tan",
        "Binh Tang",
        "Ross Taylor",
        "Adina Williams",
        "Jian Xiang Kuan",
        "Puxin Xu",
        "Zheng Yan",
        "Iliyan Zarov",
        "Yuchen Zhang",
        "Angela Fan",
        "Melanie Kambadur",
        "Sharan Narang",
        "Aurelien Rodriguez",
        "Robert Stojnic",
        "Sergey Edunov",
        "Thomas Scialom"
    ],
    "pdf_url": "http://arxiv.org/pdf/2307.09288v2",
    "pdf_path": "data\\dataset\\m3sciqa\\papers\\arxiv2023\\6b887e82-ca3f-59e1-ae8a-f528919c1334.pdf",
    "bibtex": "@misc{touvron2023llama2openfoundationand,\n    title = {Llama 2: Open Foundation and Fine-Tuned Chat Models},\n    author = {Hugo Touvron and Louis Martin and Kevin Stone and Peter Albert and Amjad Almahairi and Yasmine Babaei and Nikolay Bashlykov and Soumya Batra and Prajjwal Bhargava and Shruti Bhosale and Dan Bikel and Lukas Blecher and Cristian Canton Ferrer and Moya Chen and Guillem Cucurull and David Esiobu and Jude Fernandes and Jeremy Fu and Wenyin Fu and Brian Fuller and Cynthia Gao and Vedanuj Goswami and Naman Goyal and Anthony Hartshorn and Saghar Hosseini and Rui Hou and Hakan Inan and Marcin Kardas and Viktor Kerkez and Madian Khabsa and Isabel Kloumann and Artem Korenev and Punit Singh Koura and Marie-Anne Lachaux and Thibaut Lavril and Jenya Lee and Diana Liskovich and Yinghai Lu and Yuning Mao and Xavier Martinet and Todor Mihaylov and Pushkar Mishra and Igor Molybog and Yixin Nie and Andrew Poulton and Jeremy Reizenstein and Rashi Rungta and Kalyan Saladi and Alan Schelten and Ruan Silva and Eric Michael Smith and Ranjan Subramanian and Xiaoqing Ellen Tan and Binh Tang and Ross Taylor and Adina Williams and Jian Xiang Kuan and Puxin Xu and Zheng Yan and Iliyan Zarov and Yuchen Zhang and Angela Fan and Melanie Kambadur and Sharan Narang and Aurelien Rodriguez and Robert Stojnic and Sergey Edunov and Thomas Scialom},\n    year = {2023},\n    eprint = {2307.09288},\n    archivePrefix = {arXiv},\n    primaryClass = {cs.CL},\n    url = {http://arxiv.org/abs/2307.09288},\n}",
    "abstract": "In this work, we develop and release Llama 2, a collection of pretrained and\nfine-tuned large language models (LLMs) ranging in scale from 7 billion to 70\nbillion parameters. Our fine-tuned LLMs, called Llama 2-Chat, are optimized for\ndialogue use cases. Our models outperform open-source chat models on most\nbenchmarks we tested, and based on our human evaluations for helpfulness and\nsafety, may be a suitable substitute for closed-source models. We provide a\ndetailed description of our approach to fine-tuning and safety improvements of\nLlama 2-Chat in order to enable the community to build on our work and\ncontribute to the responsible development of LLMs.",
    "num_pages": 77
}